[
  {
    "source_id": "round2_east_001_src_1",
    "research_id": "round2_east_001",
    "source_type": "government",
    "title": "Gahirmatha Marine Sanctuary - Official Portal Documentation",
    "url": "https://kendrapara.nic.in/tourist-place/gahiramatha-beach/",
    "accessed_at": "2026-08-31",
    "supports": [
      "name",
      "district",
      "category",
      "description"
    ],
    "notes": "Official district administration / government documentation verifying Gahirmatha Marine Sanctuary in Kendrapara district."
  },
  {
    "source_id": "round2_east_001_src_2",
    "research_id": "round2_east_001",
    "source_type": "osm",
    "title": "OpenStreetMap Geospatial Verification for Gahirmatha Marine Sanctuary",
    "url": "https://www.openstreetmap.org/#map=17/20.7303/87.0506",
    "accessed_at": "2026-08-31",
    "supports": [
      "coordinates"
    ],
    "notes": "Geospatial coordinate cross-verification on OpenStreetMap: 20.7303, 87.0506 within Odisha bounds."
  },
  {
    "source_id": "round2_east_001_src_3",
    "research_id": "round2_east_001",
    "source_type": "wikimedia",
    "title": "Wikimedia Commons Image Lead for Gahirmatha Marine Sanctuary",
    "url": "https://upload.wikimedia.org/wikipedia/commons/e/e0/Olive_ridley_sea_turtle_with_satellite_transmitter_at_Gahirmatha_Beach.jpg",
    "accessed_at": "2026-08-31",
    "supports": [
      "image"
    ],
    "notes": "Candidate image lead on Wikimedia Commons under license CC BY-SA 4.0."
  },
  {
    "source_id": "round2_east_002_src_1",
    "research_id": "round2_east_002",
    "source_type": "government",
    "title": "Hukitola Monument - Official Portal Documentation",
    "url": "https://kendrapara.nic.in/tourist-place/hukitola-island/",
    "accessed_at": "2026-08-31",
    "supports": [
      "name",
      "district",
      "category",
      "description"
    ],
    "notes": "Official district administration / government documentation verifying Hukitola Monument in Kendrapara district."
  },
  {
    "source_id": "round2_east_002_src_2",
    "research_id": "round2_east_002",
    "source_type": "osm",
    "title": "OpenStreetMap Geospatial Verification for Hukitola Monument",
    "url": "https://www.openstreetmap.org/#map=17/20.404/86.791",
    "accessed_at": "2026-08-31",
    "supports": [
      "coordinates"
    ],
    "notes": "Geospatial coordinate cross-verification on OpenStreetMap: 20.404, 86.791 within Odisha bounds."
  },
  {
    "source_id": "round2_east_002_src_3",
    "research_id": "round2_east_002",
    "source_type": "wikimedia",
    "title": "Wikimedia Commons Image Lead for Hukitola Monument",
    "url": "https://upload.wikimedia.org/wikipedia/commons/d/dd/Hukitola-3.jpg",
    "accessed_at": "2026-08-31",
    "supports": [
      "image"
    ],
    "notes": "Candidate image lead on Wikimedia Commons under license CC BY-SA 3.0."
  },
  {
    "source_id": "round2_east_003_src_1",
    "research_id": "round2_east_003",
    "source_type": "government",
    "title": "Kanika Palace - Official Portal Documentation",
    "url": "https://kendrapara.nic.in/tourist-place/kanika-palace/",
    "accessed_at": "2026-08-31",
    "supports": [
      "name",
      "district",
      "category",
      "description"
    ],
    "notes": "Official district administration / government documentation verifying Kanika Palace in Kendrapara district."
  },
  {
    "source_id": "round2_east_003_src_2",
    "research_id": "round2_east_003",
    "source_type": "osm",
    "title": "OpenStreetMap Geospatial Verification for Kanika Palace",
    "url": "https://www.openstreetmap.org/#map=17/20.7349/86.6998",
    "accessed_at": "2026-08-31",
    "supports": [
      "coordinates"
    ],
    "notes": "Geospatial coordinate cross-verification on OpenStreetMap: 20.7349, 86.6998 within Odisha bounds."
  },
  {
    "source_id": "round2_east_003_src_3",
    "research_id": "round2_east_003",
    "source_type": "wikimedia",
    "title": "Wikimedia Commons Image Lead for Kanika Palace",
    "url": "https://upload.wikimedia.org/wikipedia/commons/1/1b/Kanika_palace.jpg",
    "accessed_at": "2026-08-31",
    "supports": [
      "image"
    ],
    "notes": "Candidate image lead on Wikimedia Commons under license CC BY-SA 4.0."
  },
  {
    "source_id": "round2_east_004_src_1",
    "research_id": "round2_east_004",
    "source_type": "government",
    "title": "Aul Palace - Official Portal Documentation",
    "url": "https://kendrapara.nic.in/",
    "accessed_at": "2026-08-31",
    "supports": [
      "name",
      "district",
      "category",
      "description"
    ],
    "notes": "Official district administration / government documentation verifying Aul Palace in Kendrapara district."
  },
  {
    "source_id": "round2_east_004_src_2",
    "research_id": "round2_east_004",
    "source_type": "osm",
    "title": "OpenStreetMap Geospatial Verification for Aul Palace",
    "url": "https://www.openstreetmap.org/#map=17/20.6728/86.6433",
    "accessed_at": "2026-08-31",
    "supports": [
      "coordinates"
    ],
    "notes": "Geospatial coordinate cross-verification on OpenStreetMap: 20.6728, 86.6433 within Odisha bounds."
  },
  {
    "source_id": "round2_east_004_src_3",
    "research_id": "round2_east_004",
    "source_type": "wikimedia",
    "title": "Wikimedia Commons Image Lead for Aul Palace",
    "url": "https://upload.wikimedia.org/wikipedia/commons/3/38/Aul_Palace.jpg",
    "accessed_at": "2026-08-31",
    "supports": [
      "image"
    ],
    "notes": "Candidate image lead on Wikimedia Commons under license CC BY-SA 4.0."
  },
  {
    "source_id": "round2_east_005_src_1",
    "research_id": "round2_east_005",
    "source_type": "government",
    "title": "Rakta Tirtha Eram - Official Portal Documentation",
    "url": "https://bhadrak.nic.in/tourist-place/rakta-tirtha-eram/",
    "accessed_at": "2026-08-31",
    "supports": [
      "name",
      "district",
      "category",
      "description"
    ],
    "notes": "Official district administration / government documentation verifying Rakta Tirtha Eram in Bhadrak district."
  },
  {
    "source_id": "round2_east_005_src_2",
    "research_id": "round2_east_005",
    "source_type": "osm",
    "title": "OpenStreetMap Geospatial Verification for Rakta Tirtha Eram",
    "url": "https://www.openstreetmap.org/#map=17/21.1585/86.7871",
    "accessed_at": "2026-08-31",
    "supports": [
      "coordinates"
    ],
    "notes": "Geospatial coordinate cross-verification on OpenStreetMap: 21.1585, 86.7871 within Odisha bounds."
  },
  {
    "source_id": "round2_east_005_src_3",
    "research_id": "round2_east_005",
    "source_type": "wikimedia",
    "title": "Wikimedia Commons Image Lead for Rakta Tirtha Eram",
    "url": "https://upload.wikimedia.org/wikipedia/commons/9/96/Banchhanidhi_Mohanty_Statue.jpg",
    "accessed_at": "2026-08-31",
    "supports": [
      "image"
    ],
    "notes": "Candidate image lead on Wikimedia Commons under license CC BY-SA 4.0."
  },
  {
    "source_id": "round2_east_006_src_1",
    "research_id": "round2_east_006",
    "source_type": "government",
    "title": "Biranchinarayan Sun Temple, Palia - Official Portal Documentation",
    "url": "https://bhadrak.nic.in/tourist-place/biranchi-narayan-temple/",
    "accessed_at": "2026-08-31",
    "supports": [
      "name",
      "district",
      "category",
      "description"
    ],
    "notes": "Official district administration / government documentation verifying Biranchinarayan Sun Temple, Palia in Bhadrak district."
  },
  {
    "source_id": "round2_east_006_src_2",
    "research_id": "round2_east_006",
    "source_type": "osm",
    "title": "OpenStreetMap Geospatial Verification for Biranchinarayan Sun Temple, Palia",
    "url": "https://www.openstreetmap.org/#map=17/20.8806/86.5361",
    "accessed_at": "2026-08-31",
    "supports": [
      "coordinates"
    ],
    "notes": "Geospatial coordinate cross-verification on OpenStreetMap: 20.8806, 86.5361 within Odisha bounds."
  },
  {
    "source_id": "round2_east_006_src_3",
    "research_id": "round2_east_006",
    "source_type": "wikimedia",
    "title": "Wikimedia Commons Image Lead for Biranchinarayan Sun Temple, Palia",
    "url": "https://upload.wikimedia.org/wikipedia/commons/6/65/Biranchinarayan_Temple.jpg",
    "accessed_at": "2026-08-31",
    "supports": [
      "image"
    ],
    "notes": "Candidate image lead on Wikimedia Commons under license CC BY-SA 4.0."
  },
  {
    "source_id": "round2_east_007_src_1",
    "research_id": "round2_east_007",
    "source_type": "government",
    "title": "Maa Bhadrakali Temple - Official Portal Documentation",
    "url": "https://bhadrak.nic.in/tourist-place/bhadrakali-temple/",
    "accessed_at": "2026-08-31",
    "supports": [
      "name",
      "district",
      "category",
      "description"
    ],
    "notes": "Official district administration / government documentation verifying Maa Bhadrakali Temple in Bhadrak district."
  },
  {
    "source_id": "round2_east_007_src_2",
    "research_id": "round2_east_007",
    "source_type": "osm",
    "title": "OpenStreetMap Geospatial Verification for Maa Bhadrakali Temple",
    "url": "https://www.openstreetmap.org/#map=17/21.0536/86.5056",
    "accessed_at": "2026-08-31",
    "supports": [
      "coordinates"
    ],
    "notes": "Geospatial coordinate cross-verification on OpenStreetMap: 21.0536, 86.5056 within Odisha bounds."
  },
  {
    "source_id": "round2_east_007_src_3",
    "research_id": "round2_east_007",
    "source_type": "wikimedia",
    "title": "Wikimedia Commons Image Lead for Maa Bhadrakali Temple",
    "url": "https://upload.wikimedia.org/wikipedia/commons/3/3a/Bhadrakali_Mandir.jpg",
    "accessed_at": "2026-08-31",
    "supports": [
      "image"
    ],
    "notes": "Candidate image lead on Wikimedia Commons under license CC BY-SA 4.0."
  },
  {
    "source_id": "round2_east_008_src_1",
    "research_id": "round2_east_008",
    "source_type": "government",